{
  "created_at": "2026-10-09T00:10:16.849654Z",
  "definition": {
    "capabilities": [
      "context:project-guidance"
    ],
    "details": {
      "audience": "codex",
      "files": [
        {
          "destination": "AGENTS.md",
          "source": "project-guidance.md"
        }
      ],
      "scope": "project"
    },
    "documentation": "docs/resources/context-project-guidance.md",
    "id": "context/project-guidance",
    "kind": "context",
    "name": "project-guidance",
    "prerequisites": {
      "commands": [],
      "requirements": [
        "Select only when project-local Codex guidance is wanted; review the sample before adoption."
      ]
    },
    "purpose": "Example Codex project-local guidance delivered explicitly as AGENTS.md.",
    "revision": "1.0.0",
    "schema_version": 2,
    "targets": [
      "any"
    ],
    "verification": {
      "command": [
        "python3",
        "scripts/xorder/verify-bundles.py",
        "context/project-guidance"
      ]
    }
  },
  "id": "context/project-guidance",
  "input_fingerprint": "06f053552a515111d02a4c1e76e9c0cfb1b9f9f9e5f2a64ca7be0a1dcc895c36",
  "lifecycle": "available",
  "publication": {
    "evidence": "https://github.com/xormania/xorder/actions/runs/37863331446",
    "filename": "project-guidance-1.0.0.tar",
    "format": "tar",
    "public_download_verified_at": "2026-10-09T00:10:16.849654Z",
    "sha256": "4a1c7ff451e8f835c1d921c9a212af8d129e3ed166789d3cd52c9c01aef442ff",
    "size_bytes": 10240,
    "url": "https://github.com/xormania/xorder/releases/download/context/project-guidance/v1.0.0/project-guidance-1.0.0.tar"
  },
  "schema_version": 2,
  "source_commit": "e2c8db2439b20ee51079063e4595c7f0f0e7d6e5",
  "source_tag": "context/project-guidance/v1.0.0",
  "verification": {
    "commands": [
      [
        "python3",
        "scripts/xorder/verify-bundles.py",
        "context/project-guidance",
        "$ARTIFACT_ROOT"
      ]
    ],
    "completed_at": "2026-10-09T00:10:16.849654Z",
    "evidence": "https://github.com/xormania/xorder/actions/runs/37863331446",
    "status": "passed",
    "surface": "github-actions-linux-amd64"
  },
  "version": "1.0.0"
}
